[
  {
    "schema_version": "2.0.0",
    "source_id": "cfsrc:caseforge.india.limitation-rules:c60c2fa528267fa5",
    "title": "The Limitation Act, 1963",
    "jurisdiction": "India",
    "jurisdiction_path": [
      "India",
      "Central Law",
      "Limitation"
    ],
    "authority_type": "STATUTE",
    "issuing_authority": "Parliament of India",
    "citation": "Act No. 36 of 1963",
    "section": "Section 4",
    "effective_from": "1963-10-05",
    "effective_to": "UNKNOWN",
    "version": "India Code consolidated PDF acquired 2026-08-16; verbatim extract of the controlled partition pack",
    "amendment": "Consolidated text; amendments and state variations are shown in official footnotes",
    "source_file": "content/limitation_act_1963_extract.txt",
    "page": 1,
    "paragraph": "Section 4",
    "heading_path": [
      "The Limitation Act, 1963",
      "Section 4",
      "Expiry of prescribed period when court is closed"
    ],
    "exact_text": "4. Expiry of prescribed period when court is closed.—Where the prescribed period for any suit,\nappeal or application expires on a day when the court is closed, the suit, appeal or application may be\ninstituted, preferred or made on the day when the court re-opens.\nExplanation.—A court shall be deemed to be closed on any day within the meaning of this section if\nduring any part of its normal working hours it remains closed on that day.",
    "checksum": "sha256:c60c2fa528267fa54bf8e18dc26a2337534eee128b95dc218370eb7e7fb5c4f6",
    "pack_id": "caseforge.india.limitation-rules",
    "trust_level": "OFFICIAL_VERIFIED",
    "superseded_status": "CURRENT",
    "publisher": "India Code, Ministry of Law and Justice, Legislative Department",
    "source_reference": "https://www.indiacode.nic.in/bitstream/123456789/1565/5/A1963-36.pdf",
    "content_kind": "AUTHORITATIVE_TEXT",
    "derived_from_source_id": null,
    "holding_tags": [],
    "proposition_tags": [
      "limitation",
      "deadline",
      "computation-of-period"
    ],
    "chunk_id": "cfchunk:caseforge.india.limitation-rules:51f69ec4f0914620",
    "source_checksum": "sha256:c60c2fa528267fa54bf8e18dc26a2337534eee128b95dc218370eb7e7fb5c4f6",
    "pack_checksum": "c9c097eef5d08d2cdaa72c80ff61c046ade86ac18acca1cdc5516fd1c7081bb2",
    "temporal_status": "APPLICABLE"
  },
  {
    "schema_version": "2.0.0",
    "source_id": "cfsrc:caseforge.india.limitation-rules:2b4a8fddfc4aa4c7",
    "title": "The Limitation Act, 1963",
    "jurisdiction": "India",
    "jurisdiction_path": [
      "India",
      "Central Law",
      "Limitation"
    ],
    "authority_type": "STATUTE",
    "issuing_authority": "Parliament of India",
    "citation": "Act No. 36 of 1963",
    "section": "Section 12",
    "effective_from": "1963-10-05",
    "effective_to": "UNKNOWN",
    "version": "India Code consolidated PDF acquired 2026-08-16; verbatim extract of the controlled partition pack",
    "amendment": "Consolidated text; amendments and state variations are shown in official footnotes",
    "source_file": "content/limitation_act_1963_extract.txt",
    "page": 1,
    "paragraph": "Section 12",
    "heading_path": [
      "The Limitation Act, 1963",
      "Section 12",
      "Exclusion of time in legal proceedings"
    ],
    "exact_text": "12. Exclusion of time in legal proceedings.—(1) In computing the period of limitation for any suit,\nappeal or application, the day from which such period is to be reckoned, shall be excluded.\n(2) In computing the period of limitation for an appeal or an application for leave to appeal or for\nrevision or for review of a judgment, the day on which the judgment complained of was pronounced and\nthe time requisite for obtaining a copy of the decree, sentence or order appealed from or sought to be\nrevised or reviewed shall be excluded.\n(3) Where a decree or order is appealed from or sought to be revised or reviewed, or where an\napplication is made for leave to appeal from a decree or order, the time requisite for obtaining a copy of\nthe judgment 1*** shall also be excluded.\n(4) In computing the period of limitation for an application to set aside an award, the time requisite\nfor obtaining a copy of the award shall be excluded.\nExplanation.—In computing under this section the time requisite for obtaining a copy of a decree or\nan order, any time taken by the court to prepare the decree or order before an application for a copy\nthereof is made shall not be excluded.",
    "checksum": "sha256:2b4a8fddfc4aa4c7c9cc5da88c8ca6bd4f00209f94f5f923c36406b4b087983b",
    "pack_id": "caseforge.india.limitation-rules",
    "trust_level": "OFFICIAL_VERIFIED",
    "superseded_status": "CURRENT",
    "publisher": "India Code, Ministry of Law and Justice, Legislative Department",
    "source_reference": "https://www.indiacode.nic.in/bitstream/123456789/1565/5/A1963-36.pdf",
    "content_kind": "AUTHORITATIVE_TEXT",
    "derived_from_source_id": null,
    "holding_tags": [],
    "proposition_tags": [
      "limitation",
      "deadline",
      "computation-of-period"
    ],
    "chunk_id": "cfchunk:caseforge.india.limitation-rules:5cf4d3f30d394a42",
    "source_checksum": "sha256:2b4a8fddfc4aa4c7c9cc5da88c8ca6bd4f00209f94f5f923c36406b4b087983b",
    "pack_checksum": "c9c097eef5d08d2cdaa72c80ff61c046ade86ac18acca1cdc5516fd1c7081bb2",
    "temporal_status": "APPLICABLE"
  },
  {
    "schema_version": "2.0.0",
    "source_id": "cfsrc:caseforge.india.limitation-rules:b1c115da8501b76f",
    "title": "The Limitation Act, 1963",
    "jurisdiction": "India",
    "jurisdiction_path": [
      "India",
      "Central Law",
      "Limitation"
    ],
    "authority_type": "STATUTE",
    "issuing_authority": "Parliament of India",
    "citation": "Act No. 36 of 1963",
    "section": "Schedule, Articles 116-117",
    "effective_from": "1963-10-05",
    "effective_to": "UNKNOWN",
    "version": "India Code consolidated PDF acquired 2026-08-16; verbatim extract of the controlled partition pack",
    "amendment": "Consolidated text; amendments and state variations are shown in official footnotes",
    "source_file": "content/limitation_act_1963_extract.txt",
    "page": 1,
    "paragraph": "Schedule, Articles 116-117",
    "heading_path": [
      "The Limitation Act, 1963",
      "Schedule, Articles 116-117",
      "Appeals under the Code of Civil Procedure and from High Court decrees"
    ],
    "exact_text": "116. Under the Code of Civil Procedure,\n1908 (5 of 1908)—\n(a) to a High Court from any Ninety days. The date of the decree or order.\ndecree or order.\n(b) to any other court from any Thirty days. The date of the decree or order.\ndecree or order.\n117. From a decree or order of any High Thirty days. The date of the decree or order.\nCourt to the same Court.",
    "checksum": "sha256:b1c115da8501b76f25c52a57d5ced5834b199fa172bcc887de9d09a5fae9d662",
    "pack_id": "caseforge.india.limitation-rules",
    "trust_level": "OFFICIAL_VERIFIED",
    "superseded_status": "CURRENT",
    "publisher": "India Code, Ministry of Law and Justice, Legislative Department",
    "source_reference": "https://www.indiacode.nic.in/bitstream/123456789/1565/5/A1963-36.pdf",
    "content_kind": "AUTHORITATIVE_TEXT",
    "derived_from_source_id": null,
    "holding_tags": [],
    "proposition_tags": [
      "limitation",
      "deadline",
      "computation-of-period"
    ],
    "chunk_id": "cfchunk:caseforge.india.limitation-rules:8d3ac314c7dd076d",
    "source_checksum": "sha256:b1c115da8501b76f25c52a57d5ced5834b199fa172bcc887de9d09a5fae9d662",
    "pack_checksum": "c9c097eef5d08d2cdaa72c80ff61c046ade86ac18acca1cdc5516fd1c7081bb2",
    "temporal_status": "APPLICABLE"
  },
  {
    "schema_version": "2.0.0",
    "source_id": "cfsrc:caseforge.india.limitation-rules:c3a96b50385c6e93",
    "title": "The Limitation Act, 1963",
    "jurisdiction": "India",
    "jurisdiction_path": [
      "India",
      "Central Law",
      "Limitation"
    ],
    "authority_type": "STATUTE",
    "issuing_authority": "Parliament of India",
    "citation": "Act No. 36 of 1963",
    "section": "Schedule, Articles 118-122",
    "effective_from": "1963-10-05",
    "effective_to": "UNKNOWN",
    "version": "India Code consolidated PDF acquired 2026-08-16; verbatim extract of the controlled partition pack",
    "amendment": "Consolidated text; amendments and state variations are shown in official footnotes",
    "source_file": "content/limitation_act_1963_extract.txt",
    "page": 1,
    "paragraph": "Schedule, Articles 118-122",
    "heading_path": [
      "The Limitation Act, 1963",
      "Schedule, Articles 118-122",
      "Applications in specified cases"
    ],
    "exact_text": "118. For leave to appear and defend a Ten days. When the summons is served.\nsuit under summary\nprocedure.\n119. Under the Arbitration Act, 1940\n(10 of 1940),—\n(a) for the filing in court of an Thirty days. The date of service of the notice of the\naward; making of the award;\n(b) for setting aside an award Thirty days. The date of service of the notice of the\nor getting an award remitted filing of the award.\nfor reconsideration.\n120. Under the Code of Civil Ninety days. The date of death of the plaintiff,\nProcedure, 1908 (5 of 1908), appellant, defendant or respondent, as\nto have the legalrepresentative the case may be.\nof a deceased plaintiff or\nappellant or of a deceased\ndefendant or respondent, made\na party.\n121. Under the same Code for an order Sixty days. The date of abatement.\nto set aside an abatement.\n122. To restore a suit or appeal or Thirty days. The date of dismissal.\napplication for review or\nrevision dismissed for default\nof appearance or for want of\nprosecution or for failure to\npay costs of service of process\nor to furnish security for costs.",
    "checksum": "sha256:c3a96b50385c6e9361553510297ae0c3fa8c3d0da015d92832eae2acb257494c",
    "pack_id": "caseforge.india.limitation-rules",
    "trust_level": "OFFICIAL_VERIFIED",